{
  "proposal_id": "22222222-2222-4222-8222-222222222222",
  "source_message_ids": [
    "11111111-1111-4111-8111-111111111111"
  ],
  "event": {
    "event_id": "33333333-3333-4333-8333-333333333333",
    "shift_id": "44444444-4444-4444-8444-444444444444",
    "event_type": "equipment_downtime",
    "title": "QC03 dừng do lỗi sensor",
    "description": "Đã báo bộ phận kỹ thuật",
    "risk_class": "R2",
    "state": "PROPOSED",
    "starts_at": "2026-07-21T23:40:00+07:00",
    "ends_at": null,
    "evidence": [
      "11111111-1111-4111-8111-111111111111"
    ]
  },
  "confidence": 0.94,
  "missing_fields": [],
  "requires_human_confirmation": true
}
